{
  "schemaVersion": 2,
  "id": "ons",
  "kind": "engine",
  "version": "1.1.0",
  "payloadClass": "runner",
  "requires": [],
  "runnerApi": "ons-process-v1",
  "testedTargets": [
    {
      "platform": "windows",
      "abi": "x64"
    },
    {
      "platform": "android",
      "abi": "arm64-v8a"
    }
  ],
  "artifacts": [
    {
      "platform": "windows",
      "abi": "x64",
      "format": "zip",
      "url": "https://github.com/nekobyran/Gamelauncher-engine-onscripter/releases/download/v1.0.0/ons-windows-x64-v1.zip",
      "sha256": "dd25eddbbf3b138d12f7ceca44d2cc6031a2cb8dfceace1cf92dd137564959cb",
      "sizeBytes": 4675726,
      "maxInstalledBytes": 10661891,
      "fileName": "ons-windows-x64-v1.zip"
    },
    {
      "platform": "android",
      "abi": "arm64-v8a",
      "format": "raw",
      "url": "https://github.com/nekobyran/Gamelauncher-engine-onscripter/releases/download/v1.1.0/Gamelauncher-engine-ons-android-arm64-v8a.zip",
      "sha256": "b6746c802f55081cae1d30128caf885bcf99c04e14cc88b11473c7c617b59301",
      "sizeBytes": 5117279,
      "maxInstalledBytes": 14096572,
      "fileName": "Gamelauncher-engine-ons-android-arm64-v8a.zip"
    }
  ]
}
